{
  "platform_id": "metasalmon",
  "platform_name": "metasalmon and metasalmonpy",
  "owner": "salmon-data-mobilization",
  "canonical_urls": [
    "https://github.com/salmon-data-mobilization/metasalmon",
    "https://github.com/salmon-data-mobilization/metasalmonpy"
  ],
  "docs_urls": [
    "https://salmon-data-mobilization.github.io/metasalmon/",
    "https://salmon-data-mobilization.github.io/metasalmonpy/",
    "https://github.com/salmon-data-mobilization/metasalmon/releases/tag/v0.6.0",
    "https://github.com/salmon-data-mobilization/metasalmonpy/releases/tag/v0.6.0"
  ],
  "access_tier": "mixed",
  "auth_access_model": "Both packages are public and install from their v0.6.0 tags without credentials. Term search reaches public vocabulary services except BioPortal, which needs BIOPORTAL_APIKEY. The review packet needs no provider credentials, because the harness judges it; the deprecated in-package LLM review and KNB publication need them.",
  "data_domains": [
    "Salmon Data Package creation",
    "semantic term search",
    "package validation",
    "ontology fetch",
    "publication helpers"
  ],
  "identifier_systems": [
    "Salmon Data Package dataset IDs",
    "table IDs",
    "semantic IRIs"
  ],
  "capabilities": {
    "discovery_search": {
      "status": "supported",
      "note": "Role-aware term search through `find_terms()` and `sources_for_role()`, exposed by the `salmon-terms` skill."
    },
    "metadata_schema": {
      "status": "supported",
      "note": "Package metadata, dictionaries, and validation workflows are core package features."
    },
    "entity_lookup": {
      "status": "partial",
      "note": "The package can search semantic terms, but it is not an operational salmon identity graph."
    },
    "identifier_crosswalks": {
      "status": "partial",
      "note": "The package supports semantic reconciliation and term requests, but not full operational crosswalk resolution."
    },
    "abundance_assessment": {
      "status": "missing",
      "note": "The package is not an assessment data platform."
    },
    "telemetry_passage": {
      "status": "missing",
      "note": "The package is not a telemetry platform."
    },
    "hatchery": {
      "status": "missing",
      "note": "No hatchery-specific workflow is exposed by the plugin's adapters."
    },
    "harvest_fishery": {
      "status": "missing",
      "note": "No harvest or fishery-specific workflow is exposed by the plugin's adapters."
    },
    "genetics_gsi": {
      "status": "missing",
      "note": "No genetics or GSI-specific workflow is exposed by the plugin's adapters."
    },
    "package_metadata_export": {
      "status": "supported",
      "note": "Package validation and the review-packet round trip are exposed through `metasalmon-skill`, and `sdp-semantic-review` judges the packets; package creation, the review console, and publication are core package features the plugin does not bridge yet."
    },
    "provenance_versioning": {
      "status": "partial",
      "note": "Both packages are pinned to the v0.6.0 tag and every adapter response reports the package version that produced it, but the plugin does not expose the provenance and publication workflow."
    },
    "bulk_access_api_ergonomics": {
      "status": "partial",
      "note": "The plugin reaches the packages through thin JSON adapters that run metasalmonpy under uv; the R route is documented rather than wrapped."
    }
  },
  "blockers": [
    "The plugin bridges term search, package validation, ontology fetch, and the review-packet round trip; package creation, the review console, and publication are not bridged yet.",
    "The adapters need uv, and network access on first use, to install metasalmonpy from its tag."
  ],
  "governance_constraints": [
    "LLM-assisted features and publication helpers may depend on external provider setup and human review.",
    "Term-request submission files GitHub issues, so it stays a dry run until the user approves the rendered text."
  ],
  "related_skills": [
    "metasalmon-skill",
    "salmon-terms",
    "sdp-semantic-review"
  ],
  "last_verified_date": "2026-10-10",
  "evidence_links": [
    "https://github.com/salmon-data-mobilization/metasalmon/releases/tag/v0.6.0",
    "https://github.com/salmon-data-mobilization/metasalmonpy/releases/tag/v0.6.0",
    "skills/metasalmon-skill/SKILL.md",
    "skills/sdp-semantic-review/SKILL.md",
    "skills/metasalmon-skill/scripts/metasalmon_api.py",
    "skills/salmon-terms/SKILL.md",
    "skills/salmon-terms/scripts/salmon_terms.py"
  ],
  "watch_fields": [
    "pinned release tag for both packages",
    "exported function signatures",
    "find_terms() default sources and ranking",
    "runtime dependency requirements"
  ]
}
